packageId,dateIssued,granuleClass,title
CREC-2022-12-12,2022-12-12,HOUSE,Constitutional Authority Statement For H.R. 9496
CREC-2022-12-12,2022-12-12,HOUSE,Constitutional Authority Statement For H.R. 9495
CREC-2022-12-12,2022-12-12,HOUSE,Constitutional Authority Statement For H.R. 9494
CREC-2022-12-12,2022-12-12,HOUSE,Constitutional Authority Statement For H.R. 9493
CREC-2022-12-12,2022-12-12,HOUSE,Constitutional Authority Statement
CREC-2022-12-12,2022-12-12,HOUSE,Public Bills And Resolutions
CREC-2022-12-12,2022-12-12,HOUSE,Reports Of Committees On Public Bills And Resolutions
CREC-2022-12-12,2022-12-12,HOUSE,"Executive Communications, Etc."
CREC-2022-12-12,2022-12-12,HOUSE,Budgetary Effects Of Paygo Legislation
CREC-2022-12-12,2022-12-12,HOUSE,Adjournment
CREC-2022-12-12,2022-12-12,HOUSE,Credit Card Skimming Fraud
CREC-2022-12-12,2022-12-12,HOUSE,Honoring The Legacy And Exemplary Work Of Congresswoman Walorski
CREC-2022-12-12,2022-12-12,HOUSE,Headlines For Illegals
CREC-2022-12-12,2022-12-12,HOUSE,Atatiana Jefferson Trial
CREC-2022-12-12,2022-12-12,HOUSE,Warren County Small Business Development Center
CREC-2022-12-12,2022-12-12,HOUSE,Love And Justice For All
CREC-2022-12-12,2022-12-12,HOUSE,Congratulating Christopher Raiford
CREC-2022-12-12,2022-12-12,HOUSE,Honoring Representatives G. K. Butterfield And David Price
CREC-2022-12-12,2022-12-12,HOUSE,Saline Lake Ecosystems In The Great Basin States Program Act Of 2021
CREC-2022-12-12,2022-12-12,HOUSE,After Recess
CREC-2022-12-12,2022-12-12,HOUSE,Recess
CREC-2022-12-12,2022-12-12,HOUSE,"Continuation Of The National Emergency With Respect To The Global
Illicit Drug Trade--Message From The President Of The United States (H."
CREC-2022-12-12,2022-12-12,HOUSE,Continuation Of The National Emergency With Respect To Serious Human Rights Abuse And Corruption--Message From The President Of The United States (H. Doc. No. 117-159)
CREC-2022-12-12,2022-12-12,HOUSE,Valley Forge Park Realignment Permit And Promise Act
CREC-2022-12-12,2022-12-12,HOUSE,Installation Of Plaque Commemorating Slave Rebellion On St. John
CREC-2022-12-12,2022-12-12,HOUSE,Red River National Wildlife Refuge Boundary Modification Act
CREC-2022-12-12,2022-12-12,HOUSE,Reauthorizing The Morris K. Udall And Stewart L. Udall Trust Fund
CREC-2022-12-12,2022-12-12,HOUSE,Bonneville Shoreline Trail Advancement Act
CREC-2022-12-12,2022-12-12,HOUSE,Saline Lake Ecosystems In The Great Basin States Program Act Of 2021
CREC-2022-12-12,2022-12-12,HOUSE,Repealing Existing Substandard Provisions Encouraging Conciliation With Tribes Act
CREC-2022-12-12,2022-12-12,HOUSE,Klamath Tribe Judgment Fund Repeal Act
CREC-2022-12-12,2022-12-12,HOUSE,Authorization To Establish Commemorative Work
CREC-2022-12-12,2022-12-12,HOUSE,James A. Rogers Jr. Post Office
CREC-2022-12-12,2022-12-12,HOUSE,Messages From The President
CREC-2022-12-12,2022-12-12,HOUSE,Charles P. Nord Post Office
CREC-2022-12-12,2022-12-12,HOUSE,W.O.C. Kort Miller Plantenberg Post Office
CREC-2022-12-12,2022-12-12,HOUSE,Pfc Jang Ho Kim Post Office Building
CREC-2022-12-12,2022-12-12,HOUSE,Andrew Gomer Williams Post Office Building
CREC-2022-12-12,2022-12-12,HOUSE,Caesar H. Wright Jr. Post Office Building
CREC-2022-12-12,2022-12-12,HOUSE,U.S. Marine Corporal Ronald R. Payne Jr. Post Office
CREC-2022-12-12,2022-12-12,HOUSE,Jesus Antonio Collazos Post Office Building
CREC-2022-12-12,2022-12-12,HOUSE,Chief Rudy Banuelos Post Office
CREC-2022-12-12,2022-12-12,HOUSE,Chairman Richard Milanovich Post Office
CREC-2022-12-12,2022-12-12,HOUSE,Officer Leo Pavlak Post Office Building
CREC-2022-12-12,2022-12-12,HOUSE,Charles W. Lindberg Post Office
CREC-2022-12-13,2022-12-13,SENATE,Confirmations
CREC-2022-12-13,2022-12-13,SENATE,Discharged Nominations
CREC-2022-12-13,2022-12-13,SENATE,Adjournment Until 10 A.M. Tomorrow
CREC-2022-12-13,2022-12-13,SENATE,"Orders For Wednesday, December 14, 2022"
CREC-2022-12-13,2022-12-13,SENATE,Measure Read The First Time--S. 5244
CREC-2022-12-13,2022-12-13,SENATE,Honoring The Life And Legacy Of Secretary Ash Carter
CREC-2022-12-13,2022-12-13,SENATE,Commending And Congratulating The Portland Thorns Football Club On Winning The 2022 National Women'S Soccer League Championship
CREC-2022-12-13,2022-12-13,SENATE,African Diaspora Heritage Month Act Of 2022
CREC-2022-12-13,2022-12-13,SENATE,Respect For Child Survivors Act
CREC-2022-12-13,2022-12-13,SENATE,Data Mapping To Save Moms' Lives Act
CREC-2022-12-13,2022-12-13,SENATE,Legislative Session
CREC-2022-12-13,2022-12-13,SENATE,Executive Calendar (Executive Session)
CREC-2022-12-13,2022-12-13,SENATE,Legislative Session
CREC-2022-12-13,2022-12-13,SENATE,Executive Calendar (Executive Session)
CREC-2022-12-13,2022-12-13,SENATE,Unanimous Consent Agreement--Executive Calendar
CREC-2022-12-13,2022-12-13,SENATE,James M. Inhofe National Defense Authorization Act For Fiscal Year 2023
CREC-2022-12-13,2022-12-13,SENATE,Authority For Committees To Meet
CREC-2022-12-13,2022-12-13,SENATE,Text Of Senate Amendment 6519
CREC-2022-12-13,2022-12-13,SENATE,Text Of Senate Amendment 6518
CREC-2022-12-13,2022-12-13,SENATE,Text Of Senate Amendment 6517
CREC-2022-12-13,2022-12-13,SENATE,Text Of Senate Amendment 6516
CREC-2022-12-13,2022-12-13,SENATE,Text Of Senate Amendment 6515
CREC-2022-12-13,2022-12-13,SENATE,Text Of Senate Amendment 6514
CREC-2022-12-13,2022-12-13,SENATE,Text Of Senate Amendment 6513
CREC-2022-12-13,2022-12-13,SENATE,Text Of Senate Amendment 6512
CREC-2022-12-13,2022-12-13,SENATE,Text Of Amendments
CREC-2022-12-13,2022-12-13,SENATE,Amendments Submitted And Proposed
CREC-2022-12-13,2022-12-13,SENATE,Senate Resolution 870--Honoring The Life And The Legacy Of Secretary Ash Carter
CREC-2022-12-13,2022-12-13,SENATE,Submitted Resolutions
CREC-2022-12-13,2022-12-13,SENATE,Additional Cosponsors
CREC-2022-12-13,2022-12-13,SENATE,Submission Of Concurrent And Senate Resolutions
CREC-2022-12-13,2022-12-13,SENATE,Introduction Of Bills And Joint Resolutions
CREC-2022-12-13,2022-12-13,SENATE,Executive Reports Of Committee
CREC-2022-12-13,2022-12-13,SENATE,Reports Of Committees
CREC-2022-12-13,2022-12-13,SENATE,Measures Read The First Time
CREC-2022-12-13,2022-12-13,SENATE,Measures Discharged
CREC-2022-12-13,2022-12-13,SENATE,Measures Discharged Petition
CREC-2022-12-13,2022-12-13,SENATE,Messages From The House
CREC-2022-12-13,2022-12-13,SENATE,Tribute To Chesna Foord
CREC-2022-12-13,2022-12-13,SENATE,Vote Explanation
CREC-2022-12-13,2022-12-13,SENATE,Recognizing The 90Th Anniversary Of World Learning
CREC-2022-12-13,2022-12-13,SENATE,Tribute To Ca Van Tran
CREC-2022-12-13,2022-12-13,SENATE,Tribute To Dean Seibert
CREC-2022-12-13,2022-12-13,SENATE,Tribute To Thao Griffiths
CREC-2022-12-13,2022-12-13,SENATE,Legislative Session
CREC-2022-12-13,2022-12-13,SENATE,Tribute To Rob Portman (Executive Calendar)
CREC-2022-12-13,2022-12-13,SENATE,Yemen (Executive Calendar)
CREC-2022-12-13,2022-12-13,SENATE,Immigration Reform (Executive Calendar)
CREC-2022-12-13,2022-12-13,SENATE,Yemen (Executive Calendar)
CREC-2022-12-13,2022-12-13,SENATE,Unanimous Consent Request--Executive Calendar (Executive Calendar)
CREC-2022-12-13,2022-12-13,SENATE,Unanimous Consent Request--Executive Calendar (Executive Calendar)
CREC-2022-12-13,2022-12-13,SENATE,Order Of Business (Executive Calendar)
CREC-2022-12-13,2022-12-13,SENATE,Nomination Of Eric M. Garcetti (Executive Calendar)
CREC-2022-12-13,2022-12-13,SENATE,Charter Schools (Executive Calendar)
CREC-2022-12-13,2022-12-13,SENATE,Unanimous Consent Agreement (Executive Calendar)
CREC-2022-12-13,2022-12-13,SENATE,Vote On Shambaugh Nomination (Executive Calendar)
CREC-2022-12-13,2022-12-13,SENATE,Executive Calendar--Continued
CREC-2022-12-13,2022-12-13,SENATE,Recess
CREC-2022-12-13,2022-12-13,SENATE,Conclusion Of Morning Business
CREC-2022-12-13,2022-12-13,SENATE,Reservation Of Leader Time
CREC-2022-12-13,2022-12-13,SENATE,Pledge Of Allegiance
CREC-2022-12-13,2022-12-13,SENATE,Prayer
CREC-2022-12-13,2022-12-13,SENATE,Senate
CREC-2022-12-13,2022-12-13,SENATE,Senate
CREC-2022-12-13,2022-12-13,HOUSE,Constitutional Authority Statement For H.R. 9507
CREC-2022-12-13,2022-12-13,HOUSE,Constitutional Authority Statement For H.R. 9506
CREC-2022-12-13,2022-12-13,HOUSE,Constitutional Authority Statement For H.R. 9505
CREC-2022-12-13,2022-12-13,HOUSE,Constitutional Authority Statement For H.R. 9504
CREC-2022-12-13,2022-12-13,HOUSE,Constitutional Authority Statement For H.R. 9503
CREC-2022-12-13,2022-12-13,HOUSE,Constitutional Authority Statement For H.R. 9502
CREC-2022-12-13,2022-12-13,HOUSE,Constitutional Authority Statement For H.R. 9501
CREC-2022-12-13,2022-12-13,HOUSE,Additional Sponsors
CREC-2022-12-13,2022-12-13,HOUSE,Constitutional Authority Statement For H.J. Res. 102
CREC-2022-12-13,2022-12-13,HOUSE,Constitutional Authority Statement For H.R. 9523
CREC-2022-12-13,2022-12-13,HOUSE,Constitutional Authority Statement For H.R. 9522
CREC-2022-12-13,2022-12-13,HOUSE,Constitutional Authority Statement For H.R. 9521
CREC-2022-12-13,2022-12-13,HOUSE,Constitutional Authority Statement For H.R. 9520
CREC-2022-12-13,2022-12-13,HOUSE,Constitutional Authority Statement For H.R. 9519
CREC-2022-12-13,2022-12-13,HOUSE,Constitutional Authority Statement For H.R. 9518
CREC-2022-12-13,2022-12-13,HOUSE,Constitutional Authority Statement For H.R. 9500
CREC-2022-12-13,2022-12-13,HOUSE,Constitutional Authority Statement For H.R. 9517
CREC-2022-12-13,2022-12-13,HOUSE,Constitutional Authority Statement For H.R. 9516
CREC-2022-12-13,2022-12-13,HOUSE,Constitutional Authority Statement For H.R. 9515
CREC-2022-12-13,2022-12-13,HOUSE,Constitutional Authority Statement For H.R. 9514
CREC-2022-12-13,2022-12-13,HOUSE,Constitutional Authority Statement For H.R. 9513
CREC-2022-12-13,2022-12-13,HOUSE,Constitutional Authority Statement For H.R. 9512
CREC-2022-12-13,2022-12-13,HOUSE,Constitutional Authority Statement For H.R. 9511
CREC-2022-12-13,2022-12-13,HOUSE,Constitutional Authority Statement For H.R. 9510
CREC-2022-12-13,2022-12-13,HOUSE,Constitutional Authority Statement For H.R. 9509
CREC-2022-12-13,2022-12-13,HOUSE,Constitutional Authority Statement For H.R. 9508
CREC-2022-12-13,2022-12-13,HOUSE,Constitutional Authority Statement
CREC-2022-12-13,2022-12-13,HOUSE,Public Bills And Resolutions
CREC-2022-12-13,2022-12-13,HOUSE,Reports Of Committees On Public Bills And Resolutions
CREC-2022-12-13,2022-12-13,HOUSE,"Executive Communications, Etc."
CREC-2022-12-13,2022-12-13,HOUSE,Adjournment
CREC-2022-12-13,2022-12-13,HOUSE,Veterans Affairs Week Of Action
CREC-2022-12-13,2022-12-13,HOUSE,Sami'S Law
CREC-2022-12-13,2022-12-13,HOUSE,James D. Todd United States Courthouse
CREC-2022-12-13,2022-12-13,HOUSE,Paul D. Wellstone Building Act Of 2022
CREC-2022-12-13,2022-12-13,HOUSE,Expressing The Commitment Of The House Of Representatives To Building On The Twenty Years Of Success Of The George Mcgovern-Robert Dole Food For Education And Child Nutrition Program
CREC-2022-12-08,2022-12-08,HOUSE,"Explanatory Material Statement Submitted By Mr. Smith Of Washington, Chair Of The House Committee On Armed Services, On H. Res. 1512, James M. Inhofe National Defense Authorization Act For Fiscal..."
CREC-2022-12-08,2022-12-08,HOUSE,House Of Representatives
CREC-2022-12-08,2022-12-08,DAILYDIGEST,Daily Digest/Next Meeting Of The Senate + Next Meeting Of The House Of Representatives + Other End Matter
CREC-2022-12-08,2022-12-08,DAILYDIGEST,Daily Digest/Committee Meetings For 2022-12-12
CREC-2022-12-08,2022-12-08,DAILYDIGEST,Daily Digest/House Committee Meetings
CREC-2022-12-08,2022-12-08,DAILYDIGEST,Daily Digest/House Of Representatives
CREC-2022-12-08,2022-12-08,DAILYDIGEST,Daily Digest/Senate Committee Meetings
CREC-2022-12-08,2022-12-08,DAILYDIGEST,Daily Digest/Senate
CREC-2022-12-08,2022-12-08,HOUSE,James M. Inhofe National Defense Authorization Act For Fiscal Year 2023
CREC-2022-12-08,2022-12-08,HOUSE,House Of Representatives
CREC-2022-12-08,2022-12-08,SENATE,Confirmations
CREC-2022-12-08,2022-12-08,SENATE,"Adjournment Until Monday, December 12, 2022, At 3 P.M."
CREC-2022-12-08,2022-12-08,SENATE,North Korean Human Rights Reauthorization Act Of 2022
CREC-2022-12-08,2022-12-08,SENATE,"Orders For Monday, December 12, 2022"
CREC-2022-12-08,2022-12-08,SENATE,Quantum Computing Cybersecurity Preparedness Act
CREC-2022-12-08,2022-12-08,SENATE,Expressing Support For The Designation Of September 2022 As Sickle Cell Disease Awareness Month
CREC-2022-12-08,2022-12-08,SENATE,"Relating To The Death Of Alan R. Parker, Former Staff Director And Chief Counsel Of The Committee On Indian Affairs Of The Senate"
CREC-2022-12-08,2022-12-08,SENATE,Expressing Support For The Designation Of October 2022 As ``National Co-Op Month''
CREC-2022-12-08,2022-12-08,SENATE,"Posthumously Awarding The Congressional Gold Medal, Collectively, To Glen Doherty, Tyrone Woods, J. Christopher Stevens, And Sean Smith"
CREC-2022-12-08,2022-12-08,SENATE,Dr. Joanne Smith Memorial Rehabilitation Innovation Centers Act Of 2021
CREC-2022-12-08,2022-12-08,SENATE,Celebrating The Heritage Of Romani Americans
CREC-2022-12-08,2022-12-08,SENATE,Equal Pay For Team Usa Act Of 2021
CREC-2022-12-08,2022-12-08,SENATE,Help Find The Missing Act
CREC-2022-12-08,2022-12-08,SENATE,Directing The Joint Committee Of Congress On The Library To Remove The Bust Of Roger Brooke Taney In The Old Supreme Court Chamber Of The Capitol And To Obtain A Bust Of Thurgood Marshall For...
CREC-2022-12-08,2022-12-08,SENATE,Text Of Senate Amendment 6511
CREC-2022-12-08,2022-12-08,SENATE,Text Of Senate Amendment 6510
CREC-2022-12-08,2022-12-08,SENATE,Text Of Senate Amendment 6509
CREC-2022-12-08,2022-12-08,SENATE,Text Of Amendments
CREC-2022-12-08,2022-12-08,SENATE,Amendments Submitted And Proposed
CREC-2022-12-08,2022-12-08,SENATE,"Text Of Amendments December 7, 2022"
CREC-2022-12-08,2022-12-08,SENATE,"Amendments Submitted And Proposed December 7, 2022"
CREC-2022-12-08,2022-12-08,SENATE,Senate Concurrent Resolution 50--Recognizing The Significance Of Equal Pay And The Disparity In Wages Paid To Men As Compared To Wages Paid To Latina Women
CREC-2022-12-08,2022-12-08,SENATE,Senate Resolution 868--Expressing Support For The Designation Of September 2022 As ``Sickle Cell Disease Awareness Month'' In Order To Educate Communities Across The United States About Sickle Cell...
CREC-2022-12-08,2022-12-08,SENATE,"Senate Resolution 867--Relating To The Death Of The Alan R. Parker, Former Staff Director And Chief Counsel Of The Committee On Indian Affairs Of The Senate"
CREC-2022-12-08,2022-12-08,SENATE,"Senate Resolution 866--Expressing Support For The Designation Of October 2022 As ``National Co-Op Month'' And Commending The Cooperative Business Model And The Member-Owners, Businesses, Employees..."
CREC-2022-12-08,2022-12-08,SENATE,Senate Resolution 865--Commending And Congratulating The Northern Arizona University Lumberjacks Men'S Cross Country Team For Winning The 2022 National Collegiate Athletic Association Cross Country...
CREC-2022-12-08,2022-12-08,SENATE,Submitted Resolutions
CREC-2022-12-08,2022-12-08,SENATE,Additional Cosponsors
CREC-2022-12-08,2022-12-08,SENATE,Submission Of Concurrent And Senate Resolutions
CREC-2022-12-08,2022-12-08,SENATE,Introduction Of Bills And Joint Resolutions
CREC-2022-12-08,2022-12-08,SENATE,Executive Reports Of Committee
CREC-2022-12-08,2022-12-08,SENATE,Reports Of Committees
CREC-2022-12-08,2022-12-08,SENATE,Executive And Other Communications
CREC-2022-12-08,2022-12-08,SENATE,Messages From The House
CREC-2022-12-08,2022-12-08,SENATE,Additional Statements
CREC-2022-12-08,2022-12-08,SENATE,Tribute To Major Patrick ``Ryan'' Alban
CREC-2022-12-08,2022-12-08,SENATE,Remembering Lois Curtis
CREC-2022-12-08,2022-12-08,SENATE,Tribute To Duncan Wyse
CREC-2022-12-08,2022-12-08,SENATE,Vote Explanation
CREC-2022-12-08,2022-12-08,SENATE,Vote Explanation
CREC-2022-12-08,2022-12-08,SENATE,Vote Explanation
CREC-2022-12-08,2022-12-08,SENATE,Arms Sales Notification
CREC-2022-12-08,2022-12-08,SENATE,Evelyn Brandt Thomas
CREC-2022-12-08,2022-12-08,SENATE,Legislative Session
CREC-2022-12-08,2022-12-08,SENATE,Executive Calendar
CREC-2022-12-08,2022-12-08,SENATE,Executive Calendar
CREC-2022-12-08,2022-12-08,SENATE,Order Of Business (Executive Calendar)
CREC-2022-12-08,2022-12-08,SENATE,National Defense Authorization Act (Executive Calendar)
CREC-2022-12-08,2022-12-08,SENATE,Prevent Pandemics Act (Executive Calendar)
CREC-2022-12-08,2022-12-08,SENATE,Tribute To Rob Portman (Executive Calendar)
CREC-2022-12-08,2022-12-08,SENATE,Farewell To The Senate (Executive Calendar)
CREC-2022-12-08,2022-12-08,SENATE,Executive Calendar
CREC-2022-12-08,2022-12-08,SENATE,Cloture Vote (Executive Calendar)
CREC-2022-12-08,2022-12-08,SENATE,Unanimous Consent Request--S. 4431--Continued (Executive Calendar)
CREC-2022-12-08,2022-12-08,SENATE,Signing Authority (Executive Calendar)
CREC-2022-12-08,2022-12-08,SENATE,Executive Calendar
CREC-2022-12-08,2022-12-08,SENATE,Cloture Motion
CREC-2022-12-08,2022-12-08,SENATE,Vote On Hopkins Nomination (Executive Session)
CREC-2022-12-08,2022-12-08,SENATE,Nomination Of Jeffrey Paul Hopkins (Executive Session)
CREC-2022-12-08,2022-12-08,SENATE,Tribute To Rob Portman (Executive Session)
CREC-2022-12-08,2022-12-08,SENATE,National Defense Authorization Act And Government Funding (Executive Session)
CREC-2022-12-08,2022-12-08,SENATE,One-Year Anniversary Of Western Kentucky Tornadoes (Executive Session)
CREC-2022-12-08,2022-12-08,SENATE,Recognition Of The Minority Leader (Executive Session)
CREC-2022-12-08,2022-12-08,SENATE,National Defense Authorization Act (Executive Session)
CREC-2022-12-08,2022-12-08,SENATE,Democratic Caucus (Executive Session)
CREC-2022-12-08,2022-12-08,SENATE,Recognition Of The Majority Leader (Executive Session)
CREC-2022-12-08,2022-12-08,SENATE,Government Funding (Executive Session)
CREC-2022-12-08,2022-12-08,SENATE,Executive Calendar (Executive Session)
CREC-2022-12-08,2022-12-08,SENATE,Conclusion Of Morning Business
CREC-2022-12-08,2022-12-08,SENATE,Reservation Of Leader Time
CREC-2022-12-08,2022-12-08,SENATE,Pledge Of Allegiance
CREC-2022-12-08,2022-12-08,SENATE,Prayer
CREC-2022-12-08,2022-12-08,SENATE,Senate
CREC-2022-12-08,2022-12-08,SENATE,Senate
CREC-2022-12-08,2022-12-08,HOUSE,Discharge Petitions--Additions And Withdrawals
CREC-2022-12-08,2022-12-08,HOUSE,Constitutional Authority Statement For H.R. 9469
CREC-2022-12-08,2022-12-08,HOUSE,Constitutional Authority Statement For H.R. 9468
CREC-2022-12-08,2022-12-08,HOUSE,Constitutional Authority Statement For H.R. 9467
CREC-2022-12-08,2022-12-08,HOUSE,Constitutional Authority Statement For H.R. 9466
CREC-2022-12-08,2022-12-08,HOUSE,Constitutional Authority Statement For H.R. 9465
CREC-2022-12-08,2022-12-08,HOUSE,Constitutional Authority Statement For H.R. 9464
CREC-2022-12-08,2022-12-08,HOUSE,Constitutional Authority Statement For H.R. 9463
CREC-2022-12-08,2022-12-08,HOUSE,Additional Sponsors
CREC-2022-12-08,2022-12-08,HOUSE,Constitutional Authority Statement For H.J. Res. 101
CREC-2022-12-08,2022-12-08,HOUSE,Constitutional Authority Statement For H.R. 9484
CREC-2022-12-08,2022-12-08,HOUSE,Constitutional Authority Statement For H.R. 9483
CREC-2022-12-08,2022-12-08,HOUSE,Constitutional Authority Statement For H.R. 9482
CREC-2022-12-08,2022-12-08,HOUSE,Constitutional Authority Statement For H.R. 9481
CREC-2022-12-08,2022-12-08,HOUSE,Constitutional Authority Statement For H.R. 9480
CREC-2022-12-08,2022-12-08,HOUSE,Constitutional Authority Statement For H.R. 9462
CREC-2022-12-19,2022-12-19,SENATE,Confirmations
CREC-2022-12-19,2022-12-19,SENATE,Adjournment Until 10 A.M. Tomorrow
CREC-2022-12-19,2022-12-19,SENATE,Order For Adjournment
CREC-2022-12-19,2022-12-19,SENATE,"Orders For Tuesday, December 20, 2022"
CREC-2022-12-19,2022-12-19,SENATE,Authority For Committees To Meet
CREC-2022-12-19,2022-12-19,SENATE,Text Of Senate Amendment 6552
CREC-2022-12-19,2022-12-19,SENATE,Text Of Senate Amendment 6551
CREC-2022-12-19,2022-12-19,SENATE,Text Of Senate Amendment 6550
CREC-2022-12-19,2022-12-19,SENATE,Text Of Senate Amendment 6549
CREC-2022-12-19,2022-12-19,SENATE,Text Of Senate Amendment 6548
CREC-2022-12-19,2022-12-19,SENATE,Text Of Senate Amendment 6547
CREC-2022-12-19,2022-12-19,SENATE,Text Of Senate Amendment 6546
CREC-2022-12-19,2022-12-19,SENATE,Text Of Senate Amendment 6545
CREC-2022-12-19,2022-12-19,SENATE,Text Of Senate Amendment 6544
CREC-2022-12-19,2022-12-19,SENATE,Text Of Amendments
CREC-2022-12-19,2022-12-19,SENATE,Amendments Submitted And Proposed
CREC-2022-12-19,2022-12-19,SENATE,Submitted Resolutions
CREC-2022-12-19,2022-12-19,SENATE,Statement On Introduced Bills And Joint Resolutions
CREC-2022-12-19,2022-12-19,SENATE,Additional Cosponsors
CREC-2022-12-19,2022-12-19,SENATE,Submission Of Concurrent And Senate Resolutions
CREC-2022-12-19,2022-12-19,SENATE,Introduction Of Bills And Joint Resolutions
CREC-2022-12-19,2022-12-19,SENATE,Reports Of Committees
CREC-2022-12-19,2022-12-19,SENATE,Enrolled Bills Presented
CREC-2022-12-19,2022-12-19,SENATE,Message From The House Received During Adjounrment
CREC-2022-12-19,2022-12-19,SENATE,Additional Statements
CREC-2022-12-19,2022-12-19,SENATE,Tribute To Dean A. Williams
CREC-2022-12-19,2022-12-19,SENATE,Tribute To Lieutenant Colonel Jeffrey ``Slander'' Entine
CREC-2022-12-19,2022-12-19,SENATE,Vote Explanation
CREC-2022-12-19,2022-12-19,SENATE,Joint Explanatory Statement
CREC-2022-12-19,2022-12-19,SENATE,Tribute To Janet Green-Tucker
CREC-2022-12-19,2022-12-19,SENATE,Recognizing Darn Tough Vermont
CREC-2022-12-19,2022-12-19,SENATE,Morning Business
CREC-2022-12-19,2022-12-19,SENATE,State Offices Of Rural Health Program Reauthorization Act Of 2022
CREC-2022-12-19,2022-12-19,SENATE,Expressing The Sense Of The Senate That Activities Of Transnational Criminal Organizations Pose A Risk To The Interests Of The United States And Allies And Partners Of The United States Around The...
CREC-2022-12-19,2022-12-19,SENATE,Veterans Benefits Improvement Act Of 2021
CREC-2022-12-19,2022-12-19,SENATE,Preventing Child Sex Abuse Act Of 2022
CREC-2022-12-19,2022-12-19,SENATE,Eliminate Network Distribution Of Child Exploitation Act
CREC-2022-12-19,2022-12-19,SENATE,National Cemeteries Preservation And Protection Act Of 2022
CREC-2022-12-19,2022-12-19,SENATE,Mst Claims Coordination Act
CREC-2022-12-19,2022-12-19,SENATE,Strengthening Va Cybersecurity Act Of 2022
CREC-2022-12-19,2022-12-19,SENATE,"Amending Title 38, United States Code, To Improve Hearings Before The Board Of Veterans' Appeals Regarding Claims Involving Military Sexual Trauma"
CREC-2022-12-19,2022-12-19,SENATE,Veterans Eligible To Transfer School (Vets) Credit Act
CREC-2022-12-19,2022-12-19,SENATE,"Directing The Secretary Of Veterans Affairs To Seek To Enter Into An Agreement With The National Academies Of Sciences, Engineering, And Medicine For A Review Of Examinations, Furnished By The..."
CREC-2022-12-19,2022-12-19,SENATE,The Calendar
CREC-2022-12-19,2022-12-19,SENATE,Saline Lake Ecosystems In The Great Basin States Program Act Of 2022
CREC-2022-12-19,2022-12-19,SENATE,Faster Payments To Veterans' Survivors Act Of 2022
CREC-2022-12-19,2022-12-19,SENATE,Improving Access To The Va Home Loan Benefit Act Of 2022
CREC-2022-12-19,2022-12-19,SENATE,Red River National Wildlife Refuge Boundary Modification Act
CREC-2022-12-19,2022-12-19,SENATE,House Bills
CREC-2022-12-19,2022-12-19,SENATE,Hualapai Tribe Water Rights Settlement Act Of 2022
CREC-2022-12-19,2022-12-19,SENATE,Amending The White Mountain Apache Tribe Water Rights Quantification Act Of 2010
CREC-2022-12-19,2022-12-19,SENATE,Old Pascua Community Land Acquisition Act
CREC-2022-12-19,2022-12-19,SENATE,Native American Language Resource Center Act Of 2021
CREC-2022-12-19,2022-12-19,SENATE,Durbin Feeling Native American Languages Act Of 2021
CREC-2022-12-19,2022-12-19,SENATE,Blackwater Trading Post Land Transfer Act
CREC-2022-12-19,2022-12-19,SENATE,Colorado River Indian Tribes Water Resiliency Act Of 2021
CREC-2022-12-19,2022-12-19,SENATE,Don Young Alaska Native Health Care Land Transfers Act Of 2022
CREC-2022-12-19,2022-12-19,SENATE,Jon Glawe Post Office
CREC-2022-12-19,2022-12-19,SENATE,Leonard Scarcella Post Office Building
CREC-2022-12-19,2022-12-19,SENATE,Dr. C.T. Wright Post Office Building
CREC-2022-12-19,2022-12-19,SENATE,J.I. Washington Post Office Building
CREC-2022-12-19,2022-12-19,SENATE,"Pfc James Anderson, Jr., Post Office Building"
CREC-2022-12-19,2022-12-19,SENATE,John R. Hatcher Iii Post Office Building
CREC-2022-12-19,2022-12-19,SENATE,Veterans Of Iraq And Afghanistan Memorial Post Office Building
CREC-2022-12-19,2022-12-19,SENATE,Marine Corps Reserve Pvt Jacob Cruz Post Office
CREC-2022-12-19,2022-12-19,SENATE,Andrew Gomer Williams Post Office Building
CREC-2022-12-19,2022-12-19,SENATE,Charles W. Lindberg Post Office
CREC-2022-12-19,2022-12-19,SENATE,Officer Leo Pavlak Post Office Building
CREC-2022-12-19,2022-12-19,SENATE,U.S. Marine Corporal Ronald R. Payne Jr. Post Office
CREC-2022-12-19,2022-12-19,SENATE,Dr. Ezra S. Parke Post Office Building
CREC-2022-12-19,2022-12-19,SENATE,Pfc Jang Ho Kim Post Office Building
CREC-2022-12-19,2022-12-19,SENATE,James A. Rogers Jr. Post Office
CREC-2022-12-19,2022-12-19,SENATE,Charles P. Nord Post Office
CREC-2022-12-19,2022-12-19,SENATE,W.O.C. Kort Miller Plantenberg Post Office
CREC-2022-12-19,2022-12-19,SENATE,Caesar H. Wright Jr. Post Office Building
CREC-2022-12-19,2022-12-19,SENATE,Thelma Harper Post Office Building
CREC-2022-12-19,2022-12-19,SENATE,"First Sergeant Leonard A. Funk, Jr. Post Office Building"
CREC-2022-12-19,2022-12-19,SENATE,Neal Kenneth Todd Post Office
